obra_id,contrato,cpl,objeto,secretaria,empresa_contratada,cnpj,cnpj_valido,valor_contrato,percentual_concluido,status,financiadora,previsao_conclusao,quantidade,logradouro,bairro,municipio,uf,cep
1,007/2024,360/2022,construção de uma mini cidade do trãnsito (financiamento internacional - caf).,SEAD - Secretaria de Administração,IMPREJ ENGENHARIA LTDA,50559772000136,1,"1629269,16","94,30%",Ativo,CAF,2024-10-11,918.00 m²,Avenida Itavuvu,Jardim Santa Cecilia,Sorocaba,SP,18079-803
2,350/2023,187/2021,execução do complexo viário de interligação da av. fernando stecca com a av. independência (financiamento internacional - caf,SEAD - Secretaria de Administração,CONSTRUTORA ETAMA LTDA,03867171000100,1,"13981334,70","99,97%",Ativo,CAF,2024-10-19,7875.00 m²,Avenida Fernando Stecca,Iporanga,Sorocaba,SP,18087-149
3,460/2023,266/2021,reabilitação da infraestrutura viária em diversas ruas do setor 5,SEAD - Secretaria de Administração,CASAMAX COMERCIAL E SERVIÇOS LTDA,08183516000120,1,"47534491,92","96,19%",Ativo,NDB,2025-03-22,211.96 m,Rua Zelinda Mozer Boldrin,Pq. São Bento,Sorocaba,SP,18072-049
4,423/2023,550/2021,obra de pavimentação e construção de travessia sobre o córrego entre a rua walter lacava com a rua nelson juliano - wanel ville iv - villagio torino.,SEAD - Secretaria de Administração,OBRAGEN ENGENHARIA E CONSTRUÇÕES LTDA,01817838000135,1,"4293328,66","99,55%",Ativo,FONPLATA,2024-11-05,2000.00 m²,Rua Nelson Juliano,Wanel Ville,Sorocaba,,18055-878
5,358/2023,257/2021,"obras de implantação de vias compreendidas pelas ruas rodolfo garia, miguel ascêncio e travessa, no bairro brigadeiro tobias.",SEAD - Secretaria de Administração,OBRAGEN ENGENHARIA E CONSTRUÇÕES LTDA,01817838000135,1,"7537046,54","100,00%",Ativo,FONPLATA,2024-10-04,93.70 m,Rua Três,Brigadeiro Tobias,Sorocaba,SP,18108-240
6,392/2023,554/2021,obra de pavimentação e construção de igação da av. olinda aires paulete - jd. sta. lúcia com a av. ulisses guimarães.,SEAD - Secretaria de Administração,OBRAGEN ENGENHARIA E CONSTRUÇÕES LTDA,01817838000135,1,"2072625,84","99,91%",Ativo,FONPLATA,2024-09-30,1800.00 m²,Avenida Olinda Aires Paulete,Jd. Santa Lúcia,Sorocaba,,18078-702
7,442/2023,543/2021,reabilitação da infraestrutura viária em vias do setor 4.,SEAD - Secretaria de Administração,S. A. Paulista de Construções e Comércio,60332319000146,1,"16136668,25","99,04%",Ativo,NDB,2025-02-19,612.18 m,Rua Antônio Silva Oliveira,Vila Hortência,Sorocaba,SP,18020-170
8,443/2023,543/2021,reabilitação da infraestrutura viária em vias do setor 4 (financiamento internacional),SEAD - Secretaria de Administração,FRECHALTORE CONSTRUTORA LTDA,10608207000105,1,"10757778,83","96,20%",Ativo,NDB,2025-02-19,780.00 m,Rua Quinzinho de Barros,Vila Hortência,Sorocaba,SP,18020-180
9,649/2024,591/2023,pavimentação e construção da ligação da av. mário campolim com a rua romeu do nascimento.,SEAD - Secretaria de Administração,CASAMAX COMERCIAL E SERVIÇOS LTDA,08183516000120,1,"4693081,02","95,76%",Ativo,CAF,2024-11-10,10272.00 m²,Avenida Mário Campolim,Campolim,Sorocaba,SP,18047410
10,382/2023,462/2021,execução de obras de pavimentação e construção da ligação da rua francisco augusto - jd. são guilherme ii com a rua alcindo leite - jd. paulista.,SEAD - Secretaria de Administração,OBRAGEN ENGENHARIA E CONSTRUÇÕES LTDA,01817838000135,1,"3090527,34","99,98%",Ativo,FONPLATA,2024-06-16,4931.00 m²,Rua Francisco Augusto,Jd. São Guilherme II,Sorocaba,SP,18074-605
11,433/2023,458/2021,reabilitaçao da infraestrutura viária em vias do setor 7.,SEAD - Secretaria de Administração,CASAMAX COMERCIAL E SERVIÇOS LTDA - CONSÓRCIO DUPLICAÇÃO E PAVIMENTAÇÃO SOROCABA,08183516000120,1,"25406904,34","99,21%",Ativo,NDB,2024-10-24,711.81 m,Rua João Silvestre,Cajuru do Sul,Sorocaba,SP,18105-170
12,200/2023,186/2021,"duplicação e pavimentação da av. três de março, entre a av. engº carlos reinaldo mendes e a rua quirino de mello no município de sorocaba (financiamento internacional - caf)",SEAD - Secretaria de Administração,CASAMAX COMERCIAL E SERVIÇOS LTDA - CONSÓRCIO DUPLICAÇÃO E PAVIMENTAÇÃO SOROCABA,08183516000120,1,"45150546,24","87,05%",Ativo,CAF,None,110.00 m²,Avenida Três de Março,Aparecidinha,Sorocaba,SP,18087-180
13,201/2023,186/2021,"duplicação e pavimentação da av. três de março, entre a av. engº carlos reinaldo mendes e a rua quirino de mello no município de sorocaba (financiamento internacional - caf)",SEAD - Secretaria de Administração,OESTEVALLE PAVIMENTAÇÕES E CONSTRUÇÕES LTDA - CONSÓRCIO DUPLICAÇÃO E PAVIMENTAÇÃO SOROCABA,06931094000107,1,"45150546,24","99,45%",Ativo,CAF,2024-11-17,110.00 m²,Avenida Três de Março,Aparecidinha,Sorocaba,SP,18087-180
14,732/2022,294/2021,"duplicação da rua pereira da fonseca e recuperação da pista existe, bem como vpavimentação e requalificação asfáltica na rua prof. franco de almeida filho (financiamento internacional)",SEAD - Secretaria de Administração,TECLA CONSTRUÇÕES LTDA,53552691000100,1,"20647428,94","99,99%",Ativo,CAF,2024-09-08,5500.00 m²,Avenida Conde Zeppelin,Éden,Sorocaba,SP,18103-008
15,17/2024,30/2023,construção de unidade de atenção especializada em saúde (oliclínica) - contrato de repasse nº 905321/2020/msaude/caixa - convênio com o governo federal,SES - Secretaria da Saúde,IMPREJ ENGENHARIA LTDA,50559772000136,1,"21179294,46","65,39%",Ativo,CAIXA,2026-07-07,0.00 m²,AVENIDA IPANEMA,,SOROCABA,SP,18071-801
16,440/2023,443/2022,implantação de pista de skate no jardim são guilherme,SERPO - Secretaria de Serviços Públicos e Obras,"W2 MANUTENÇÕES, CONSTRUÇÕES E REFORMAS",07335981000177,1,"121849,01","99,99%",Ativo,PREFEITURA MUNICIPAL DE SOROCABA,2024-05-31,0.00 m²,RUA FRANCISCO AUGUSTO,JD SAO GUILHERME,SOROCABA,SP,18074-651
17,179/2023,006/2022,construção de escola municipal no jd. amália.,SEDU - Secretaria da Educação,IMPREJ ENGENHARIA LTDA,50559772000136,1,"9783045,89","72,72%",Ativo,PMS,2025-12-12,3113.75 m²,Rua Tenente José Ribeiro da Silva,,,,18103-645
18,452/2023,221/2023,implantação de sistema de lazer no jd. dona teresa - bairro do éden.,SERPO - Secretaria de Serviços Públicos e Obras,"W2 MANUTENÇÕES, CONSTRUÇÕES E REFORMAS",07335981000177,1,"164367,73","100,00%",Ativo,ESTADUAL,2024-07-31,0.00 m²,Estrada Josefa Roz Carmona de Lima,Jardim Dona Teresa,Sorocaba,SP,18103-063
19,921/2023,426/2023,implantação de sistema de playground e estacionamento na rua arthur caligari - jd. são conrado,SERPO - Secretaria de Serviços Públicos e Obras,DCA ENGENHARIA E CONSTRUÇÕES EIRELI,14634377000107,1,"345352,39","99,51%",Ativo,Câmara Municipal de Sorocaba,2024-09-27,0.00 m²,Rua Arthur Cagliari,,Sorocaba,SP,18076-210
20,583/2024,257/2023,reforma do céu das artes - laranjeiras.,SEQUAV - Secretaria de Esporte e Qualidade de Vida,"W2 MANUTENÇÕES, CONSTRUÇÕES E REFORMAS",07335981000177,1,"1435037,01","98,72%",Ativo,PREFEITURA MUNICIPAL DE SOROCABA,2024-11-23,0.00 m²,Rua Washington Pensa,Parque Laranjeiras,Sorocaba,SP,18077-688
21,839/2023,291/2023,implantação de academia ao ar livre no parque das paineiras.,SERPO - Secretaria de Serviços Públicos e Obras,MAHAL SERVIÇOS EM CONSTRUÇÕES EIRELI,21355502000105,1,"84983,97","96,07%",Ativo,Câmara Municipal de Sorocaba,2024-07-31,0.00 m²,Rua Eliza Stefani,Parque Paineiras,Sorocaba,SP,18078-619
22,909/2023,389/2023,investimentos urbanísticos e obras na região do bairro brigadeiro tobias,SERPO - Secretaria de Serviços Públicos e Obras,MAHAL SERVIÇOS EM CONSTRUÇÕES EIRELI,21355502000105,1,"226862,77","100,00%",Ativo,Câmara Municipal de Sorocaba,2024-08-07,0.00 m²,Avenida bandeirantes,Brigadeiro Tobias,Sorocaba,SP,18108-540
23,903/2023,416/2023,construção de passarela e passeio público no jardim santa luiza.,SERPO - Secretaria de Serviços Públicos e Obras,DCA ENGENHARIA E CONSTRUÇÕES LTDA,14634377000107,1,"229821,62","99,99%",Ativo,Câmara Municipal de Sorocaba,2024-10-01,0.00 m²,Rua Marco Antônio Laino,Jd. Santa Luiza,,,18078-620
24,872/2023,293/2023,implantação de academia ao ar livre no jd. harmonia,SERPO - Secretaria de Serviços Públicos e Obras,"W2 MANUTENÇÕES, CONSTRUÇÕES E REFORMAS",07335981000177,1,"96120,73","98,45%",Ativo,Câmara Municipal de Sorocaba,2024-06-04,0.00 m²,Rua Maria do Carmo C. Pogian,Jd Harmonia,,,18103-656
25,459/2023,235/2023,implantação de centro de convivência esportiva no jd dos pássaros,SERPO - Secretaria de Serviços Públicos e Obras,"W2 MANUTENÇÕES, CONSTRUÇÕES E REFORMAS",07335981000177,1,"352505,24","100,00%",Ativo,Convênio Estadual,2024-07-31,0.00 m²,Rua Arlindo Pereira Fernandes,Jd dos Pássaros,Sorocaba,SP,18103-812
26,899/2023,290/2023,implantação de quadra de areia e playground no jardim nilton torres.,SERPO - Secretaria de Serviços Públicos e Obras,"W2 MANUTENÇÕES, CONSTRUÇÕES E REFORMAS",07335981000177,1,"227445,24","99,39%",Ativo,Câmara Municipal de Sorocaba,2024-07-10,0.00 m²,Rua Aurélio Borgio,Jd Nilton Torres,Sorocaba,SP,18105-516
27,699/2024,367/2023,reforma e adequações de acessibilidade na unidade mista brigadeiro tobias.,SES - Secretaria da Saúde,SERRALHERIA SÃO JOSÉ LTDA,11619205000176,1,"336492,85","99,81%",Ativo,PREFEITURA MUNICIPAL DE SOROCABA,2025-03-08,769.62 m²,Rua Ana Gomes Correa,Brigadeiro Tobias,Sorocaba,SP,18108-185
28,605/2024,337/2023,contratação de empresa para reforma do ginásio municipal dr. gualberto moreira.,SEQUAV - Secretaria de Esporte e Qualidade de Vida,VIVA CONSTRUÇÕES E SERVIÇOS LTDA,08756015000196,1,"651021,54","98,67%",Ativo,Convênio Estadual,2024-10-31,3421.66 m²,Rua Duarte da Costa,Vila Hortência,Sorocaba,SP,18020-040
29,878/2023,444/2023,execuçãode academia ao ar livre com a reforma da quadra no bairro jardim carolina.,SERPO - Secretaria de Serviços Públicos e Obras,"W2 MANUTENÇÕES, CONSTRUÇÕES E REFORMAS",07335981000177,1,"158937,89","99,09%",Ativo,Câmara Municipal de Sorocaba,2024-07-31,0.00 m²,Rua jair Salim Junior,Jd. Carolina,,,18103-535
30,912/2023,414/2023,implantação de espaço para cães no parque dos espanhóis - dog park.,SERPO - Secretaria de Serviços Públicos e Obras,MAHAL SERVIÇOS EM CONSTRUÇÕES EIRELI,21355502000105,1,"67910,16","100,00%",Ativo,Câmara Municipal de Sorocaba,2024-05-03,0.00 m²,Rua Dr. Campos Salles,Vila Assis,Sorocaba,SP,18025-100
31,906/2023,350/2023,"revitalização do centro de convivência esportivo ""josé antonio camargo - zeca""",SERPO - Secretaria de Serviços Públicos e Obras,"W2 MANUTENÇÕES, CONSTRUÇÕES E REFORMAS",07335981000177,1,"282853,79","93,64%",Ativo,Câmara Municipal de Sorocaba,2024-08-31,0.00 m²,Rua Izidro Sanches,Cajuru,Sorocaba,SP,18105-100
32,450/2023,233/2023,implantação de centro esportivo no jardim amália - bairro do éden,SERPO - Secretaria de Serviços Públicos e Obras,"W2 MANUTENÇÕES, CONSTRUÇÕES E REFORMAS",07335981000177,1,"338162,00","100,00%",Ativo,Convênio Estadual,2024-07-11,0.00 m²,Rua Tenente José Ribeiro da Silva,Jd Amália,,,18103-645
33,910/2023,335/2023,ampliação e melhorias em playground na vila mineirão,SERPO - Secretaria de Serviços Públicos e Obras,MAHAL SERVIÇOS EM CONSTRUÇÕES EIRELI,21355502000105,1,"107776,40","96,10%",Ativo,Câmara Municipal de Sorocaba,2024-07-31,0.00 m²,Rua Antero Jose da Rosa,Vila Mineirão,Sorocaba,SP,18076-482
34,676/2024,403/2023,execução de obras gerais para construção da nova rodoviária de sorocaba (financiamento internacional),SEAD - Secretaria de Administração,CONSÓRCIO TMS-INCRETE,55560274000127,1,"55940695,08","32,72%",Ativo,CAF,2025-10-01,38.00 m²,Avenida Doutor José Bella Neto,Reserva Parque Fazenda Imperial,Sorocaba,,18052-775
35,29/2024,572/2022,obras de adequações de acessibilidade na ubs márcia mendes.,SES - Secretaria da Saúde,"W2 MANUTENÇÕES, CONSTRUÇÕES E REFORMAS",07335981000177,1,"184827,86","100,00%",Ativo,PREFEITURA MUNICIPAL DE SOROCABA,2024-10-19,0.00 m²,Rua José A. Rabello Junior,Jd. Vera Cruz,Sorocaba,SP,18050-180
36,509/2024,526/2023,reforma parcial do espaço solidário do fundo social de solidariedade.,FSS - Fundo Social de Solidariedade,DCA ENGENHARIA E CONSTRUÇÕES EIRELI,14634377000107,1,"174280,50","100,00%",Ativo,Câmara Municipal de Sorocaba,2024-09-27,112.08 m²,Avenida Rudolf Dafferner,Alto da Boa Vista,Sorocaba,SP,18013-280
37,689/2024,349/2023,"construção de vestiário nocentro esportivo ""andré matielo"".",SEQUAV - Secretaria de Esporte e Qualidade de Vida,"W2 MANUTENÇÕES, CONSTRUÇÕES E REFORMAS",07335981000177,1,"594638,53","100,00%",Ativo,Convênio Estadual,2024-12-31,0.00 m²,Rua Rua Pedro Lara Moraes,Pinheiros,Sorocaba,SP,18025-009
38,758/2024,98/2024,"implantação de quadra de basquete, revitalização da quadra e playground e ampliação do sistema de iluminação pública no jardim são camilo.",SERPO - Secretaria de Serviços Públicos e Obras,VIVA CONSTRUÇÕES E SERVIÇOS LTDA,08756015000196,1,"220000,00","100,00%",Ativo,Emenda Impositiva,2025-03-10,0.00 m²,Rua João Penitente,Jardim São Camilo,Sorocaba,SP,18078-145
39,757/2024,85/2024,incremento às ações de urbanização em área pública - revitalização das praças josé vicente vannuchi e benedito paes de almeida.,SERPO - Secretaria de Serviços Públicos e Obras,VIVA CONSTRUÇÕES E SERVIÇOS LTDA,08756015000196,1,"200000,00","100,00%",Ativo,Emenda Impositiva,None,0.00 m²,Rua Oliveira César e Rua São Vicente,Vila Santa Rita,,,18080-125
40,445/2023,457/2021,consórcio vk pavimentação - requalificação da malha viária de ruas do setor 6,SEAD - Secretaria de Administração,KAPA PAVIMENTAÇÃO LTDA,17344459000105,1,"11552018,14","83,07%",Ativo,FONPLATA,2025-03-26,0.00 m,Alameda Família Betti,Jardim Santa Marta,Sorocaba,SP,18073-403
41,673/2022,240/2022,construção de uma creche tipo a - 10 salas padrão fnde no jardim dos alpes,SEDU - Secretaria da Educação,CASAGRANDE SERVIÇOS E CONSTRUÇÕES LTDA,05592745000100,1,"5106102,37","99,97%",Ativo,RECURSO FNDE,2024-11-11,1330.06 m²,RUA Armando Rocha,Jardim Alpes de Sorocaba,Sorocaba,SP,18079-630
42,709/2022,305/2022,construção de uma creche tipo a - 10 salas padrão fnde no jardim dos pássaros,SEDU - Secretaria da Educação,HONOS CONSTRUÇÕES E SERVIÇOS EIRELI,28703928000151,1,"6526566,69","99,31%",Ativo,RECURSOS MUNICIPAL,2024-04-27,1330.06 m²,RUA ARLINDO PEREIRA FERNANDES,JD. DOS PÁSSAROS,SOROCABA,SP,18103-812
43,676/2022,243/2022,construção de uma creche tipo a - 10 salas padrão fnde no jardim santo amaro,SEDU - Secretaria da Educação,CASAGRANDE SERVIÇOS E CONSTRUÇÕES LTDA,05592745000100,1,"5343402,09","100,00%",Ativo,Recurso FNDE,2024-12-11,1330.06 m²,RUA ESMERALDA JOÃO,JD. SANTO AMARO,SOROCABA,SP,18074-685
44,677/2022,242/2022,construção de uma creche tipo a - 05 salas padrão fnde no jardim monterrey,SEDU - Secretaria da Educação,HONOS CONSTRUÇÕES E SERVIÇOS EIRELI,28703928000151,1,"3325863,14","99,91%",Ativo,RECURSO FNDE,2025-06-28,752.07 m²,RUA ARMANDO UNRUH,JD. MONTERREY,SOROCABA,SP,18071-092
45,446/2023,457/2021,consórcio vk pavimentação - requalificação da malha viária de ruas do setor 6,SEAD - Secretaria de Administração,VIGENT CONSTRUÇÕES LTDA,15320722000109,1,"12297663,52","85,07%",Ativo,NDB,2025-03-26,0.00 m,Rua Paulo Varchavtchik,Aparecidinha,Sorocaba,SP,18087-190
46,612/2021,295/2021,construção de uma creche tipo a - 05 salas padrão fnde para atender a secretaria de educação,SEDU - Secretaria da Educação,HONOS CONSTRUÇÕES E SERVIÇOS EIRELI,28703928000151,1,"3464944,64","99,64%",Ativo,RECURSO FNDE,2023-12-28,752.07 m²,RUA ALLAN KARDEC,VILA ALMEIDA,SOROCABA,SP,18075-440
47,716/2022,303/2022,construção de uma creche tipo a - 10 salas padrão fnde no jardim itália,SEDU - Secretaria da Educação,CASAGRANDE SERVIÇOS E CONSTRUÇÕES LTDA,05592745000100,1,"6605349,82","100,00%",Ativo,Recurso Municipal,2024-04-23,1330.06 m²,Rua Arnaldo Januário Werneck,Jd. Itália,Sorocaba,SP,18103-364
48,680/2022,245/2022,construção de uma creche tipo a - 5 salas padrão fnde no conjunto habitacional júlio de mesquita filho,SEDU - Secretaria da Educação,HONOS CONSTRUÇÕES E SERVIÇOS EIRELI,28703928000151,1,"3599878,00","96,14%",Ativo,RECURSO FNDE,2025-06-28,752.02 m²,Avenida Luiz Gonzaga do Nascimento Filho,Julio de Mesquita Filho,Sorocaba,SP,18053-010
49,831/2022,244/2022,construção de uma creche tipo a - 10 salas padrão fnde no jardim santa rosa,SEDU - Secretaria da Educação,HONOS CONSTRUÇÕES E SERVIÇOS EIRELI,28703928000151,1,"6796520,25","98,96%",Ativo,RECURSO FNDE,2025-07-27,1330.06 m²,Rua Romão Fernandes,Jd. Santa Rosa,Sorocaba,SP,18071-446
50,684/2022,304/2022,construção de uma creche tipo a - 10 salas padrão fnde no jardim são bento,SEDU - Secretaria da Educação,TMS COMERCIAL CONSTRUTORA LTDA,55190417000156,1,"6749205,12","98,76%",Ativo,Recurso Municipal,2024-03-28,1330.06 m²,Rua Alcino Oliveira Rosa,Pq. São Bento,Sorocaba,SP,18072-660
51,438/2023,621/2022,construção de uma escola com 27 salas e ginásio coberto no bairro parque são bento.,SEDU - Secretaria da Educação,HONOS CONSTRUÇÕES E SERVIÇOS EIRELI,28703928000151,1,"34729252,36","30,78%",Ativo,Recurso Municipal,2026-07-18,6427.90 m²,Rua Roque Nunes,Parque São Bento,Sorocaba,SP,18072-062
52,452/2023,221/2023,implantação de sistema de lazer no jd. dona teresa - bairro do éden.,SERPO - Secretaria de Serviços Públicos e Obras,"W2 MANUTENÇÕES, CONSTRUÇÕES E REFORMAS",07335981000177,1,"164367,73","100,00%",Ativo,Convênio Estadual,2024-07-29,0.00 m²,Estrada Josefa Roz Carmona de Lima,Jd. Dona Teresa,Sorocaba,SP,18103-063
53,450/2023,233/2023,implantação de centro esportivo no jardim amália - bairro do éden,SERPO - Secretaria de Serviços Públicos e Obras,"W2 MANUTENÇÕES, CONSTRUÇÕES E REFORMAS",07335981000177,1,"338162,00","0,00%",Ativo,Convênio Estadual,2024-07-09,0.00 m²,Rua Tenente Jose Ribeiro,Jardim Amalia,Sorocaba,SP,18103-645
54,678/2022,241/2022,construção de uma creche tipo a - 10 salas padrão fnde no jardim villagio milano,SEDU - Secretaria da Educação,CASAGRANDE SERVIÇOS E CONSTRUÇÕES LTDA,05592745000100,1,"6095242,97","99,99%",Ativo,RECURSO FNDE,2024-11-11,1330.06 m²,Alameda Ravenna,Vilaggio Milano,Sorocaba,SP,18055-215
55,261/2023,529/2021,"reforma de 13 unidades escolares pertencentes à secretaria de educação , para adequações de acessibilidade.",SEDU - Secretaria da Educação,VIVA CONSTRUÇÕES E SERVIÇOS LTDA,08756015000196,1,"5245454,09","53,19%",Ativo,Recurso Municipal,2025-10-13,0.00 m²,Rua Paschoal Tulio,Vila Barcelona,Sorocaba,SP,18025-725
56,047/2024,537/2021,serviços de pavimentação asfáltica e construção de obra de arte (ponte) compondo o complexo viário de ligação entre os bairros parque são bento e residencial carandá (financiamento internacional),"CADI - Centro de Aceleração, Desenvolvimento e Inovação",CONSÓRCIO LIGAÇÃO SÃO BENTO-CARANDÁ,55689268000174,1,"43812247,73","47,99%",Ativo,NDB,None,0.00 m,Rua Waldemar Rosa dos Santos,Jardim Carandá,Sorocaba,SP,18073-109
57,500/2025,173/2024,"implantação de playground e academia ao ar livre na área exerna do ginásio municipal ""gualberto moreira"".",SERPO - Secretaria de Serviços Públicos e Obras,"W2 MANUTENÇÕES, CONSTRUÇÕES E REFORMAS",07335981000177,1,"176000,00","100,00%",Ativo,Emenda Impositiva,2025-05-26,0.00 m²,Rua José Martins,Vila Hortência,Sorocaba,SP,18020-214
58,788/2024,109/2024,grupo 1 - incremento às ações de urbanização em áreas públicas no bairro jardim são guilherme - emenda parlamentar nº 208.,SERPO - Secretaria de Serviços Públicos e Obras,DCA ENGENHARIA E CONSTRUÇÕES EIRELI,14634377000107,1,"68689,86","0,00%",Ativo,Emenda Impositiva,2025-07-03,0.00 m²,Rua Theodora Constantino Duarte,Atílio Silvano,Sorocaba,SP,18074-510
59,754/2024,086/2024,"revitalização de áreas púbicas com implantação de infraestrutura para feira livre, ampliação de área de lazer e impantação de pista de caminhada com iluminação pública em led no jardim guaíba.",SERPO - Secretaria de Serviços Públicos e Obras,RAMON AGULERA PARTICIPAÇÕES E EMPREENDIMENTOS LTDA,11823795000154,1,"294000,00","49,29%",Ativo,Emenda Impositiva,2025-09-11,0.00 m²,Rua Benedita Conceição Gomes Perbelini,Jd. Guaíba,,,18077-100
60,760/2024,161/2024,implantação de área de parkour na pista de caminhada do campolim,SERPO - Secretaria de Serviços Públicos e Obras,VIVA CONSTRUÇÕES E SERVIÇOS LTDA,08756015000196,1,"82700,00","99,99%",Ativo,Emenda Impositiva,2025-08-30,0.00 m²,Avenida Domingos Julio,Pq Campolim,,,18047-645
61,501/2025,328/2024,"implantação de playground, academia ao ar livre e iluminação led no jd santa luiza.",SERPO - Secretaria de Serviços Públicos e Obras,"W2 MANUTENÇÕES, CONSTRUÇÕES E REFORMAS",07335981000177,1,"129500,00","100,00%",Ativo,Emenda Impositiva,2025-08-18,0.00 m²,Rua Marco Antonio Laino,Jd. Santa Luiza,,,18078-280
62,640/2025,29/2025,construção de uma unidade básica de saúde tipo iv no bairro central parque.,SES - Secretaria da Saúde,VIGENT CONSTRUÇÕES LTDA,15320722000109,1,"5391369,00","39,50%",Ativo,RECURSO FEDERAL,2026-10-01,0.00 m²,RUA Nicolau Elias Tibechereny,Central Parque,Sorocaba,SP,18051-060
63,622/2025,30/2025,construção de uma unidade básica de saúde tipo iv no bairro são conrado.,SES - Secretaria da Saúde,DAMO ENGENHARIA E CONSTRUÇÕES LTDA,01770334000107,1,"5391369,00","40,70%",Ativo,RECURSO FEDERAL,2026-08-07,0.00 m²,Rua Arthur Cagliari,São Conrado,Sorocaba,SP,18076-210
64,831/2024,160/2024,construção de quadra de basquete no jardim iguatemi.,SERPO - Secretaria de Serviços Públicos e Obras,DCA ENGENHARIA E CONSTRUÇÕES EIRELI,14634377000107,1,"98000,00","100,00%",Ativo,Emenda Impositiva,2025-07-18,0.00 m²,Rua Avaré,Jd. Iguatemi,Sorocaba,SP,18085-345
65,789/2024,109/2024,grupos 2 e 3 - incremento às ações de urbanização em áreas públicas no barirro jardim são guilherme - emendas parlamentares nº 208 e 572.,SERPO - Secretaria de Serviços Públicos e Obras,VIVA CONSTRUÇÕES E SERVIÇOS LTDA,08756015000196,1,"187000,00","25,48%",Ativo,Emenda Impositiva,2025-08-31,0.00 m²,Rua Antonio Piantore,Jd. São Guilhe,Sorocaba,SP,18074-510
66,780/2024,088/2024,implantação de passeio e iluminação pública - vila hortencia.,SERPO - Secretaria de Serviços Públicos e Obras,DCA ENGENHARIA E CONSTRUÇÕES LTDA,14634377000107,1,"119999,99","100,00%",Ativo,Emenda Impositiva,2025-08-04,0.00 m²,Rua Antonio Silva de Oliveira,Vila Hortência,,,18020-150
67,348/2023,548/2021,"pavimentação, drenagem, ciclovia, iluminação, requalificação de vias e implantação de equipamentos e paisagismo pertencentes à obra denominada trecho ii da marginal itanguá - sorocaba (financiamento internacional).","CADI - Centro de Aceleração, Desenvolvimento e Inovação",CASAMAX COMERCIAL E SERVIÇOS LTDA,08183516000120,1,"81240482,73","13,23%",Ativo,CAF,2027-01-25,4000.00 m,Avenida Santa Cruz,Jardim Vera Cruz,Sorocaba,SP,18050-260
68,13/2024,052/2023,"implantação de pavimento, drenagem e requalificação viária pertencentes à obra denominada marginal direita do rio sorocaba (financiamento internacional)",SEAD - Secretaria de Administração,FORTNORT DESENVOLVIMENTO AMBIENTAL E URBANO LTDA,00900846000188,1,"16719598,13","0,00%",Ativo,CAF,2027-05-24,1800.00 m,Avenida Dom Aguirre,Jardim Santa Rosália,Sorocaba,SP,18090-002
69,014/2023,052/2023,"implantação de pavimento, drenagem e requalificação viária pertencentes à obra denominada marginal direita  do rio sorocaba (financiamento internacional)",SEAD - Secretaria de Administração,AUDITERRA TERRAPLENAGEM LTDA,58994138000133,1,"16719598,13","0,00%",Ativo,CAF,2027-05-24,1800.00 m²,Avenida Dom Aguirre,Jardim Santa Rosália,Sorocaba,SP,18090-002
