ano,municipio,orgao,categoria,arquivo,paginas,chars,status_extracao,texto_bruto,fonte_url,fonte_arquivo,publicado_em,observacao
2025,sorocaba,Camara Municipal de Sorocaba,lrf,lrf_2025.pdf,3,7358,,"CN-SIFPM MUNICIPIO DE SOROCABA CONAM
Poder Legislativo
RELATORIO DE GESTAO FISCAL
DEMONSTRATIVO DA DESPESA COM PESSOAL
ORCAMENTOS FISCAL E DA SEGURIDADE SOCIAL
Periodo de Referencia: MAIO/2024 a ABRIL/2025
RGF - ANEXO 1 (LRF, art. 55, inciso I, alinea a) R$ 1,00
DESPESAS EXECUTADAS - LIQUIDADAS (ULTIMOS 12 MESES)
DESPESA COM PESSOAL
MAIO/2024 JUNHO/2024 JULHO/2024 AGOSTO/2024 SETEMBRO/2024 OUTUBRO/2024 NOVEMBRO/2024
DESPESA BRUTA COM PESSOAL (I) 4.535.019,41 4.777.365,77 4.962.074,48 4.908.169,81 4.848.506,05 4.736.003,44 5.307.142,60
Pessoal Ativo 4.126.779,99 4.362.037,84 4.554.588,83 4.505.698,32 4.439.004,86 4.169.836,46 4.883.622,34
Vencimentos, Vantagens e Outras Despesas Variaveis 3.416.286,44 3.633.676,34 3.821.357,40 3.769.188,09 3.721.948,78 3.438.035,59 4.164.214,32
Obrigacoes Patronais 710.493,55 728.361,50 733.231,43 736.510,23 717.056,08 731.800,87 719.408,02
Beneficios Previdenciarios 0,00 0,00 0,00 0,00 0,00 0,00 0,00
Pessoal Inativo e Pensionistas 408.239,42 415.327,93 407.485,65 402.471,49 409.501,19 566.166,98 423.520,26
Aposentadorias, Reserva e Reformas 286.585,73 293.674,24 285.831,96 280.817,80 287.847,50 444.513,29 300.001,48
Pensoes 121.653,69 121.653,69 121.653,69 121.653,69 121.653,69 121.653,69 123.518,78
Outros Beneficios Previdenciarios 0,00 0,00 0,00 0,00 0,00 0,00 0,00
Outras despesas de pessoal decorrentes de contratos de terceirizacao
ou de contratacao de forma indireta(paragrafo 1 do artigo 18 da LRF) 0,00 0,00 0,00 0,00 0,00 0,00 0,00
Despesa com Pessoal nao Executada Orcamentariamente 0,00 0,00 0,00 0,00 0,00 0,00 0,00
DESPESAS NAO COMPUTADAS (II) (paragrafo 1 do artigo 19 da LRF) 289.767,95 298.646,66 277.351,93 272.337,77 279.367,47 436.033,26 262.087,98
Indeniz p/Demissao e Incentivos a Demissao Voluntaria e Deducoes Const 0,00 0,00 0,00 0,00 0,00 0,00 0,00
Decorrentes de Decisao Judicial de periodo anterior ao da apuracao 0,00 0,00 0,00 0,00 0,00 0,00 0,00
Despesas de Exercicios Anteriores de periodo anterior ao da apuracao 11.662,25 13.452,45 0,00 0,00 0,00 0,00 0,00
Inativos e Pensionistas com Recursos Vinculados 278.105,70 285.194,21 277.351,93 272.337,77 279.367,47 436.033,26 262.087,98
Agentes Com.de Saude e de Combate as Endemias c/Rec.Vinc(CF,a.198,p11) 0,00 0,00 0,00 0,00 0,00 0,00 0,00
Parcela dedutivel ref.piso salarial Enfermeiro,Tec.Enfermagem,Auxiliar
Enfermagem e Parteira (ADCT,art.38,par.2o) 0,00 0,00 0,00 0,00 0,00 0,00 0,00
Outras Deducoes Constitucionais ou Legais 0,00 0,00 0,00 0,00 0,00 0,00 0,00
DESPESA LIQUIDA COM PESSOAL (III) = (I-II) 4.245.251,46 4.478.719,11 4.684.722,55 4.635.832,04 4.569.138,58 4.299.970,18 5.045.054,62
CN-SIFPM MUNICIPIO DE SOROCABA CONAM
Poder Legislativo
RELATORIO DE GESTAO FISCAL
DEMONSTRATIVO DA DESPESA COM PESSOAL
ORCAMENTOS FISCAL E DA SEGURIDADE SOCIAL
Periodo de Referencia: MAIO/2024 a ABRIL/2025
RGF - ANEXO 1 (LRF, art. 55, inciso I, alinea a) R$ 1,00
DESPESAS EXECUTADAS - LIQUIDADAS (ULTIMOS 12 MESES) TOTAL INSCRITAS EM
DESPESA COM PESSOAL ULTIMOS 12 MESES RESTOS A PAGAR NAO
DEZEMBRO/2024 JANEIRO/2025 FEVEREIRO/2025 MARCO/2025 ABRIL/2025 (a) PROCESSADOS (b)
DESPESA BRUTA COM PESSOAL (I) 7.955.689,65 5.288.554,09 5.562.275,16 5.913.826,65 5.634.376,11 64.429.003,22 0,00
Pessoal Ativo 7.406.174,24 4.796.541,54 5.122.050,21 5.432.619,75 5.179.560,98 58.978.515,36 0,00
Vencimentos, Vantagens e Outras Despesas Variaveis 6.070.260,73 3.995.744,02 4.313.342,00 4.505.486,88 4.305.078,28 49.154.618,87 0,00
Obrigacoes Patronais 1.335.913,51 800.797,52 808.708,21 927.132,87 874.482,70 9.823.896,49 0,00
Beneficios Previdenciarios 0,00 0,00 0,00 0,00 0,00 0,00 0,00
Pessoal Inativo e Pensionistas 549.515,41 492.012,55 440.224,95 481.206,90 454.815,13 5.450.487,86 0,00
Aposentadorias, Reserva e Reformas 425.996,62 318.409,80 300.213,48 333.674,87 310.312,40 3.867.879,17 0,00
Pensoes 123.518,79 173.602,75 140.011,47 147.532,03 144.502,73 1.582.608,69 0,00
Outros Beneficios Previdenciarios 0,00 0,00 0,00 0,00 0,00 0,00 0,00
Outras despesas de pessoal decorrentes de contratos de terceirizacao
ou de contratacao de forma indireta(paragrafo 1 do artigo 18 da LRF) 0,00 0,00 0,00 0,00 0,00 0,00 0,00
Despesa com Pessoal nao Executada Orcamentariamente 0,00 0,00 0,00 0,00 0,00 0,00 0,00
DESPESAS NAO COMPUTADAS (II) (paragrafo 1 do artigo 19 da LRF) 388.083,11 326.725,41 274.937,81 324.604,13 301.422,79 3.731.366,27 0,00
Indeniz p/Demissao e Incentivos a Demissao Voluntaria e Deducoes Const 0,00 0,00 0,00 0,00 0,00 0,00 0,00
Decorrentes de Decisao Judicial de periodo anterior ao da apuracao 0,00 0,00 0,00 0,00 0,00 0,00 0,00
Despesas de Exercicios Anteriores de periodo anterior ao da apuracao 0,00 0,00 0,00 0,00 0,00 25.114,70 0,00
Inativos e Pensionistas com Recursos Vinculados 388.083,11 326.725,41 274.937,81 324.604,13 301.422,79 3.706.251,57 0,00
Agentes Com.de Saude e de Combate as Endemias c/Rec.Vinc(CF,a.198,p11) 0,00 0,00 0,00 0,00 0,00 0,00 0,00
Parcela dedutivel ref.piso salarial Enfermeiro,Tec.Enfermagem,Auxiliar
Enfermagem e Parteira (ADCT,art.38,par.2o) 0,00 0,00 0,00 0,00 0,00 0,00 0,00
Outras Deducoes Constitucionais ou Legais 0,00 0,00 0,00 0,00 0,00 0,00 0,00
DESPESA LIQUIDA COM PESSOAL (III) = (I-II) 7.567.606,54 4.961.828,68 5.287.337,35 5.589.222,52 5.332.953,32 60.697.636,95 0,00
CN-SIFPM MUNICIPIO DE SOROCABA CONAM
Poder Legislativo
RELATORIO DE GESTAO FISCAL
DEMONSTRATIVO DA DESPESA COM PESSOAL
ORCAMENTOS FISCAL E DA SEGURIDADE SOCIAL
Periodo de Referencia: MAIO/2024 a ABRIL/2025
RGF - ANEXO 1 (LRF, art. 55, inciso I, alinea a) R$ 1,00
% SOBRE
APURACAO DO CUMPRIMENTO DO LIMITE LEGAL VALOR RCL AJUSTADA
RECEITA CORRENTE LIQUIDA RCL (IV) 4.496.517.863,35
( ) Transferencias obrigatorias da Uniao relativas as emendas individuais (artigo 166 A, paragrafo 1, da CF) 15.183.783,04
( ) Transferencias obrigatorias da Uniao relativas as emendas de bancada (artigo 166, paragrafo 16, da CF) 0,00
( ) Transferencias obrigatorias da Uniao relativas a remuneracao dos agentes comunitarios de saude e dos agentes de",https://www.camarasorocaba.sp.gov.br/arquivos_publicos.html,data/extracted/sorocaba/camara/lrf/camara_lrf_sorocaba.csv,2026-05-29,inventario/texto de PDF oficial; qualidade indicada por status_extracao; caminhos locais sanitizados Limitacao: registros LDO/metas da Camara sao atas de audiencias publicas ou documentos legislativos relacionados; a LDO e as metas oficiais completas pertencem ao Executivo/Prefeitura.
2017,sorocaba,Camara Municipal de Sorocaba,metas,metas_fiscais_2017.pdf,1,487,texto_nativo_ok,"Aprimorando o Portal de Transparência (Lei Federal nº 12.527/2011)
e para melhorar a veridicidade de nossa transparência ativa, no dia 12 de
maio de 2017 a empresa Conam disponibilizou atualização relativa aos
vencimentos (Ato da mesa nº 034/2015) deste Poder Legislativo.
Clique aqui para ser redirecionado ao item Vencimentos.
Av. Engº Carlos Reinaldo Mendes, 2945 — Alto da Boa Vista — CEP 18013-904 — Sorocaba — SP — (15) 3238-1111
/camarasorocaba camarasorocaba.sp.gov.br canal 61.3",https://www.camarasorocaba.sp.gov.br/arquivos_publicos.html,data/extracted/sorocaba/camara/metas/camara_metas_sorocaba.csv,2026-05-29,inventario/texto de PDF oficial; qualidade indicada por status_extracao; caminhos locais sanitizados Limitacao: registros LDO/metas da Camara sao atas de audiencias publicas ou documentos legislativos relacionados; a LDO e as metas oficiais completas pertencem ao Executivo/Prefeitura.
2025,sorocaba,Camara Municipal de Sorocaba,metas,metas_fiscais_2025.pdf,3,5023,ocr_tesseract,"ESTADO DE SAO l'AULO

ATA DA AUDIÊNCIA PÚBLICA PARA APRESENTAÇÃO E DISCUSSÃO DAS METAS FISCAIS
DO MUNICÍPIO REFERENTES AO 1º QUADRIMESTRE DE 2025

Às 9h do dia 28 de maio de 2025, no plenário da Câmara Municipal de Sorocaba, foi
realizada audiência pública para apresentação do balanço das Metas Fiscais do
Município referentes ao 1º Quadrimestre de 2025. A audiência foi realizada sob o
comando da Comissão de Economia, Finanças, Orçamento e Parcerias, nos termos do
artigo 9º, parágrafo 4º, da Lei de Responsabilidade Fiscal (Lei Complementar nº 101, de
4 de maio de 2000). A audiência pública foi comandada pelo vereador Henri Arida,
membro da comissão, e contou com participação dos vereadores Fernanda Garcia, lara
Bernardi, Ítalo Moreira e Izídio de Brito. Prefeitura — A Secretaria da Fazenda, por meio
do titular da pasta, Marcelo Regalado, iniciou as apresentações com os números gerais
do Município. Sobre a receita primária, que somou no período R$ 1.802.894.000,00,
houve uma variação real negativa (descontada a inflação) de 1,96%, em relação ao
mesmo período do ano anterior. À apresentação destacou a evolução na arrecadação
dos impostos municipais de 2024 a 2025 de R$ 605,7 milhões para R$ 644 milhões. A
receita de contribuições passou de R$ 60 milhões para R$ 65,2 milhões. A receita de
transferências correntes foi de R$ 687,2 milhões no primeiro quadrimestre de 2024 para
R$ 735 milhões no mesmo período de 2025. As demais receitas correntes passaram de
R$ 164 milhões para R$ 166,2 milhões. Já a receita de capital foi reduzida de R$ 34,7
milhões para R$ 5,18 milhões. O resultado primário do Município (que é a diferença
entre as receitas e despesas primárias) foi positivo em R$ 25,692 milhões, sendo que a
meta fiscal para o período em 2025 era um resultado negativo em R$ 75,4 milhões,
portanto, o resultado superou a meta. O Município encerrou o período com uma dívida
consolidada líquida de R$ 180,5 milhões. Já os empréstimos contratados no primeiro
quadrimestre de 2025 — R$ 22,118 milhões — representam 0,49% da Receita Corrente
Líquida, sendo o limite de alerta de 14,4%. Após a apresentação, foi aberta espaço para
perguntas dos vereadores e o secretário as respondeu. Urbes — O diretor-presidente

interino da Urbes, Adriano Brasil, discorreu sobre os dados da empresa pública, cuja

//_;/Xá/

,3* CÂMARA MUNICIPAL DE SOROCABA

ESTADO DE SÃO PAULO

receita primária arrecadada foi de R$ 1,835 milhões no 1º quadrimestre, com queda real
de 16,6% em relação ao mesmo período de 2024. A Urbes apresentou despesa primária
paga de R$ 21,719 milhões no período, sendo que a despesa com pessoal somou R$
33,741 milhões. Após a apresentação foi aberto espaço para questionamentos dos
vereadores e o diretor os respondeu. Parque Tecnológico — Nelson Cancellara,
presidente do Parque Tecnológico, apresentou os dados da empresa pública, cuja
receita primária no período foi de R$ 1,725 milhão, representando uma redução de
78,03% em relação à receita do mesmo quadrimestre do ano anterior. A despesa com
pessoal foi de R$ 1,385 milhão, representando um aumento de 5,25% em comparação
ao primeiro quadrimestre de 2024. Após a apresentação foi aberto espaço para
questionamentos dos vereadores e o presidente do Parque Tecnológico os respondeu.
Funserv — Edgar Aparecido, diretor financeiro da Funserv (Fundação de Seguridade
Social dos Servidores Públicos Municipais), apresentou os números da Saúde e
Previdência dos servidores. Com a relação à Funserv Saúde, no primeiro quadrimestre
de 2025 a receita primária somou R$ 65,353 milhões — com variação real de 3,08% na
comparação com 2024. Já a despesa primária foi de R$ 55,223 milhões (10,16% inferior
ao mesmo período do ano passado). A previdência apresentou receita primária de R$
136,823 milhões no primeiro quadrimestre, com variação real negativa de 4,2% em
relação ao mesmo período de 2024. Já a despesa primária totalizou R$ 207,457 milhões,
com crescimento real de 11,7%. Após a apresentação foi aberto espaço para
questionamentos dos vereadores e o diretor os respondeu. Saae — O diretor
administrativo e financeiro do Saae (Serviço Autônomo de Água e Esgoto), Calixto Junior
Antonucci e Silva, apresentou os dados da autarquia, cuja receita primária somou R$k G
138,8 milhões no quadrimestre, 4,43% inferior ao mesmo período de 2024. Já a despesa 7 —É

primária do Saae foi de R$ 125 milhões (3,3% inferior ao ano anterior), sendo a despesa

1)

com pessoal de R$ 147,647 milhões. Após a apresentação foi aberto espaço para W
d

questionamentos dos vereadores e o diretor os respondeu. Câmara Municipal — AÀ

Câmara Municipal, que não possui receita própria, contabilizou, no primeiro

quadrimestre, uma despesa de R$ 24 milhões, de acordo com o Secretário de Á
A

z»?'x s


ESTADO DE SÃO PAULO

Comunicação, Fabio Mascarenhas, que encerrou as apresentações. Após a apresentação

foi aberto espaço para perguntas dos vereadores e o secretário os respondeu.

M ARCELOR/G'AtAÃD.

ADRIA»;G/ÉRASIL
F /

CALIXTO ANTONUCS

FÁBIO MASCAREN

3/3
",https://www.camarasorocaba.sp.gov.br/arquivos_publicos.html,data/extracted/sorocaba/camara/metas/camara_metas_sorocaba.csv,2026-05-29,inventario/texto de PDF oficial; qualidade indicada por status_extracao; caminhos locais sanitizados Limitacao: registros LDO/metas da Camara sao atas de audiencias publicas ou documentos legislativos relacionados; a LDO e as metas oficiais completas pertencem ao Executivo/Prefeitura.
2017,sorocaba,Camara Municipal de Sorocaba,ppa,ppa_2017.pdf,1,487,,"Aprimorando o Portal de Transparência (Lei Federal nº 12.527/2011)
e para melhorar a veridicidade de nossa transparência ativa, no dia 12 de
maio de 2017 a empresa Conam disponibilizou atualização relativa aos
vencimentos (Ato da mesa nº 034/2015) deste Poder Legislativo.
Clique aqui para ser redirecionado ao item Vencimentos.
Av. Engº Carlos Reinaldo Mendes, 2945 — Alto da Boa Vista — CEP 18013-904 — Sorocaba — SP — (15) 3238-1111
/camarasorocaba camarasorocaba.sp.gov.br canal 61.3",https://www.camarasorocaba.sp.gov.br/arquivos_publicos.html,data/extracted/sorocaba/camara/ppa/camara_ppa_sorocaba.csv,2026-05-29,inventario/texto de PDF oficial; qualidade indicada por status_extracao; caminhos locais sanitizados Limitacao: registros LDO/metas da Camara sao atas de audiencias publicas ou documentos legislativos relacionados; a LDO e as metas oficiais completas pertencem ao Executivo/Prefeitura.
2021,sorocaba,Camara Municipal de Sorocaba,ppa,ppa_2021.pdf,2,3311,,"LEI Nº 12.436, DE 12 DE NOVEMBRO DE 2021.
Estabelece o Plano Plurianual do Município para o quadriênio 2022-2025, define as metas e prioridades da
Administração Pública Municipal para o exercício de 2022 e dá outras providências.
Projeto de Lei nº 300/2021 – autoria do EXECUTIVO.
A Câmara Municipal de Sorocaba decreta e eu promulgo a seguinte Lei:
Art. 1º Esta Lei estabelece, nos termos do § 1º, art. 165, da Constituição, o Plano Plurianual (PPA) do
Município para o quadriênio 2022/2025, no qual são definidas as diretrizes, os objetivos e as metas da
administração pública municipal para as despesas de capital e outras delas decorrentes e para as relativas
aos programas de duração continuada, na forma dos anexos I a V desta Lei.
§ 1º Fica o Executivo autorizado a modificar a unidade executora ou o órgão responsável por programas,
ações e os indicadores e respectivos índices, bem como a adequar as metas físicas em função de
modificações nos programas ditados por leis, por leis de diretrizes e por leis orçamentárias e seus créditos
adicionais.
§ 2º O Plano Plurianual compreende a atuação de todos os órgãos da Administração Direta e Indireta,
inclusive da Câmara Municipal, bem como das empresas em que o Município detém o controle acionário,
consideradas, nos termos da Lei Complementar nº 101, de 4 de maio de 2000, de caráter dependente.
§ 3º No caso de empresas de caráter não dependente, somente seus investimentos estão incluídos nos
programas e ações constantes dos anexos desta Lei.
Art. 2º São estabelecidas para o quadriênio 2022/2025, as seguintes diretrizes norteadoras da execução dos
programas e ações a cargo dos órgãos municipais:
I - Cidade Urbanizada;
II - Cidade Humanizada;
III - Cidade Inovadora;
IV - Cidade com Gestão de Transparência.
Art. 3º As estimativas das receitas e dos valores dos programas e ações constantes dos anexos desta Lei são
fixadas exclusivamente para conferir consistência ao Plano, não se constituindo em limites para a elaboração
das leis de diretrizes orçamentárias, das leis orçamentárias e das suas modificações.
Art. 4º Nas leis orçamentárias ou nas que autorizem a abertura de créditos adicionais, assim como nas leis
de diretrizes orçamentárias, e nos créditos extraordinários, poderão ser criados novos programas ou ações,
ou modificados os existentes, considerando-se, em decorrência, alterado o Plano Plurianual.
Art. 5º As metas e prioridades da Administração Pública Municipal para o exercício de 2022, na
conformidade do exigido pelo § 2º, art. 165, da Constituição, são as fixadas no Anexo VI, integrante desta
Lei.
Art. 6º As despesas com a execução da presente Lei correrão por conta de verba orçamentária própria.
Art. 7º Esta Lei entra em vigor na data de sua publicação, produzindo efeitos a partir de 1º de janeiro de
2022.
Palácio dos Tropeiros “Dr. José Theodoro Mendes”, em 11 de novembro de 2021, 367º da Fundação de
Sorocaba.
RODRIGO MAGANHATO
Prefeito Municipal
LUCIANA MENDES DA FONSECA
Secretária Jurídica
AMÁLIA SAMYRA DA SILVA TOLEDO
Secretária de Governo
MARCELO DUARTE REGALADO
Secretário da Fazenda
Publicada na Divisão de Controle de Documentos e Atos Oficiais, na data supra. ANDRESSA DE BRITO
WASEM
Chefe da Divisão de Controle de Documentos e Atos Oficiais
Esse texto não substitui o publicado no DOM em 12.11.2021.",https://www.camarasorocaba.sp.gov.br/arquivos_publicos.html,data/extracted/sorocaba/camara/ppa/camara_ppa_sorocaba.csv,2026-05-29,inventario/texto de PDF oficial; qualidade indicada por status_extracao; caminhos locais sanitizados Limitacao: registros LDO/metas da Camara sao atas de audiencias publicas ou documentos legislativos relacionados; a LDO e as metas oficiais completas pertencem ao Executivo/Prefeitura.
2026,sorocaba,Camara Municipal de Sorocaba,ppa,ppa_2026.pdf,16,26030,,"SOROCABA
CÂMARA MUNICIPAL DE
ESTADO DE SÃO PAULO
ATA DA AUDIÊNCIA PÚBLICAPARA DISCUSSÃO DO PLANO PLURIANUAL PARA O
QUADRIÊNIO 2026/2029 —PRIMEIRO DIA DE AUDIÊNCIA
Às9 horas do dia 22de agosto de 2025, no plenário da Câmara Municipal de Sorocaba,
realizou-se audiência pública destinada à apresentação e discussão do Projeto de Leinº
614/2025, de autoria do Poder Executivo, que dispõe sobre o Plano Plurianual do
Município de Sorocaba para o quadriênio 2026/2029. A audiência foi conduzida pela
Comissão de Economia, Finanças, Orçamento e Parcerias, sob a presidência do vereador
Cristiano Passos. A abertura dos trabalhos foi realizada pelo presidente da Câmara
Municipal, vereador Luis Santos, que registrou considerações acerca das ações do
programa Câmara Itinerante, destacando a coleta de demandas da população e seu
encaminhamento ao Poder Executivo para compatibilização no projeto do Plano
Plurianual. Na sequência, o secretário da Fazenda, senhor Marcelo Regalado,
acompanhado de sua equipe técnica, apresentou os dados gerais da Prefeitura
Municipal relativos ao Plano Plurianual, dando início às explanações sobre o conteúdo
da proposta. Ele destacou que o PPA tem como premissas o Plano de Governo,
diagnósticos realizados pelos órgãos municipais e o planejamento estratégico, com
incentivo à participação popular. Foram recebidas 111 participações via formulário on-
line, totalizando 292 propostas, além de 66 propostas por meio do programa Câmara
Itinerante. O secretário informou que para o planejamento financeiro dos quatro
próximos anos, o PPA utilizou as projeções do Boletim Focus, do Banco Central, que
projetam crescimento de 1,70% do PIB do país em 2026 e de 2% para os demais
anos. Com relação ao orçamento global do Município previsto para o período é de R$
23,276 bilhões, sendo R$ 5,742 bilhões em 2026; R$5,722 bilhões em 2027; R$ 5,845
bilhões em 2028; e R$ 5,966 bilhões em 2029. Para a Prefeitura, a previsão de despesas
é de R$ 4,164 bilhões em 2026; R$4,075 bilhões em 2027; R$4,130 bilhões em 2028; e
RS4,179 bilhões em 2029. Em seguida o secretário apresentou os dados da Secretaria
da Fazenda contará com orçamento de R$ 306,321 milhões em 2026, chegando a R$
1/14
SOROCABA
CÂMARA MUNICIPAL DE
ESTADO DE SÃO PAULO
367,828 milhões em 2029, com destaque para amanutenção das Casas do Cidadão e
programas como IPTUPremiado e Nota Fiscal Sorocabana. Abertas às perguntas, a
vereadora lara Bernardi (PT) indagou por que os investimentos da Prefeitura diminuem
nos próximos anos, passando de R$395 milhões em 2026 para R$234 milhões em 2029.
De acordo com o secretário, o plano traz os dados consolidados e as atuais operações
de crédito refletem mais em 2026 e 2027. Sobre as previsões para Recursos Humanos —
também questionadas pela parlamentar, disse que se trata apenas do crescimento
vegetativo. Fernanda Garcia (Psol)também indagou sobre os investimentos futuros e a
política de pessoal. Porém, o secretário ressaltou que cada pasta poderá explanar sobre
o que está previsto em relação a investimentos e recursos humanos de sua pasta.
Marcelo Regalado reforçou que cada secretaria irá apresentar o planejamento
esmiuçado por área. A vereadora questionou, ainda, oaumento de R$ 2 milhões nos
recursos previstos para a gestão das nove Casas do Cidadão, de 2026 para 2027. De
acordo com o secretário, trata-se se adequações nas unidades, além do reajuste
contratual. Já Izídio de Brito (PT) disse discordar das previsões, que consideram apenas
o crescimento do PIB,pois a cidade está em crescimento, inclusive seu parque industrial.
Quis saber, ainda sobre as previsões das medidas mitigatórias. Segundo osecretário, as
medidas se referem a obras e não entram no orçamento, estando sob responsabilidade
da Secretaria da Mobilidade. Em relação às dúvidas levantadas pelos vereadores, o
secretário reforçou o caráter de planejamento de programas, ações, indicativos e metas
do PPA. Em seguida, o vereador Ítalo Moreira (União Brasil), entre outras perguntas,
citou a falta de menção no plano dos impactos da reforma tributária. Osecretário disse
que tem acompanhado a questão, porém, até 2030 não haverá mudança, devido ao
período de transição. Já o vereador Fausto Peres (Podemos) quis saber de que forma o
PPA se articula com a LOA para garantir que as metas planejadas tenham os recursos
assegurados. Marcelo Regalado afirmou que a controladoria geral é o órgão municipal
que acompanha se os orçamentos estão sendo aplicados, assim como o tribunal de
contas em nível estadual. Na sequência a secretária Samyra Toledo apresentou os
2/14
CÂMARA MUNICIPAL SOROCABA
DE
ESTADO DE SÃO PAULO
programas e ações de suas pastas, Gabinete do Poder Executivo e Secretaria de
Governo, com previsão de orçamento de R$ 2,166 milhões para o Gabinete do Executivo
em 2026 e de R$ 2,208 milhões nos três anos seguintes. Para a Secretaria de Governo,
a previsão de orçamento é de R$ 24,6 milhões em 2026 e R$ 25,2 milhões nos anos
seguintes. Asecretária discorreu sobre as principais ações da pasta, como o Programa
Concilia, voltado para a resolução de conflitos extrajudiciais e a redução das demandas
judiciais sobretudo nas áreas da educação e da saúde. O programa também envolve
conciliações de débitos em atraso inscritos em dívida ativa; a realização de assistência
jurídica gratuita mediante convênio com a OAB e a Secretaria da Cidadania; suporte a
famílias em situação de vulnerabilidade decorrentes de enchentes; e Meu Projeto
Sorocaba. Apasta também tem como áreas de atuação: acompanhar e supervisionar a
execução de projetos do governo municipal; garantir o desenvolvimento dos projetos e
cumprimentos de metas; promover o alinhamento e comunicação intersetorial;
organizar e acompanhar a realização de ações do governo municipal; e atuar nos
projetos Adote Sorocaba; Sorocaba Linda de Verdade e Sorocaba Business, além do
Procon, por meio do fortalecimento do atendimento itinerante realizado pelo órgão.
Segundo a secretária, a estimativa no Plano Plurianual é que o",https://www.camarasorocaba.sp.gov.br/arquivos_publicos.html,data/extracted/sorocaba/camara/ppa/camara_ppa_sorocaba.csv,2026-05-29,inventario/texto de PDF oficial; qualidade indicada por status_extracao; caminhos locais sanitizados Limitacao: registros LDO/metas da Camara sao atas de audiencias publicas ou documentos legislativos relacionados; a LDO e as metas oficiais completas pertencem ao Executivo/Prefeitura.
