municipio,area,anos,status,fonte_nome,fonte_url,fonte_arquivo,coletado_em,sha256_raw,script_extracao,validado_por,validado_em,publicado_em,arquivo_publico,observacao
Sorocaba,saude,2020-2025,public,Portal da Transparencia de Sorocaba; SICONFI API; RREO Anexo 12,https://fazenda.sorocaba.sp.gov.br/transparencia/; https://apidatalake.tesouro.gov.br/ords/siconfi/tt/rreo,2020-*-quadrimestre-relatorios-de-aplicacao-na-saude.pdf; 2021-*-quadrimestre-relatorios-de-aplicacao-na-saude.pdf; 2022-*-quadrimestre-relatorios-de-aplicacao-na-saude.pdf; 2023-*-quadrimestre-relatorios-de-aplicacao-na-saude.pdf; 2024-*-quadrimestre-relatorios-de-aplicacao-na-saude.pdf; 2025-*-quadrimestre-relatorios-de-aplicacao-na-saude.pdf; rreo_2020_2bimestre.pdf..rreo_2025_6bimestre.pdf,,,,pipelines/extrator_saude.py; pipelines/extrator_rreo.py; pipelines/extrator_rreo_sus.py,pipelines/testes/verificar_dados.py; pipelines/testes/verificar_dados_rreo_saude.py,,2026-05-07,data/public/sorocaba/saude/saida/*.csv,Publicado no site; rastreabilidade de origem distribuida entre Fonte_PDF e Fonte_URL nos CSVs publicados.
Sorocaba,educacao,2020-2025,public,Portal da Transparencia de Sorocaba,https://sorocaba.sp.gov.br/anexos/SEF/Transparencia/; https://sorocaba.sp.gov.br/anexos/SEF%2FTransparencia%2F,2020-1-trimestre-relatorios-de-aplicacao-no-ensino.pdf..2025-4-trimestre-relatorios-de-aplicacao-no-ensino.pdf,,,,pipelines/extrator_educacao.py,pipelines/testes/verificar_dados_educacao.py,,2026-05-07,data/public/sorocaba/educacao/saida/*.csv,Publicado apos validacao local contra PDFs oficiais preservados em data/raw; Fonte_PDF presente nos CSVs publicados.
Sorocaba,agentes,2026,public,Fontes oficiais municipais estaduais e federais,https://prefeito.sorocaba.sp.gov.br/; https://www.camarasorocaba.sp.gov.br/; https://www.sp.gov.br/sp/institucional/estrutura; https://www.camara.leg.br/deputados; https://www.al.sp.gov.br/alesp/deputados-estaduais/,poder_publico_sorocaba.json,,,,curadoria_manual_json,revisao_manual,,2026-05-07,data/public/agentes/poder_publico_sorocaba.json,Mapa de agentes publicos com fontes declaradas no proprio JSON; requer manutencao editorial explicita.
Sorocaba,execucao,2020;2024,extracted,Secretaria da Fazenda de Sorocaba - Livros Contabeis,https://fazenda.sorocaba.sp.gov.br/transparencia/,livro_conta_corrente_fornecedor_2020.pdf; livro_registro_analitico_despesa_orcamentaria_2020.pdf; livro_conta_corrente_fornecedor_2024.pdf; livro_registro_analitico_despesa_orcamentaria_2024.pdf,,,,pipelines/extrator_conta_corrente_fornecedor.py; pipelines/extrator_despesa_orcamentaria.py,revisao_local_pendente,,,,"Dados extraidos mas ainda nao publicados; camada com maior risco de exposicao adicional pela granularidade."
Sorocaba,seguranca,2020-2025,public,SICONFI DCA Anexo I-E (Despesas por Funcao e Subfuncao),https://apidatalake.tesouro.gov.br/ords/siconfi/tt/dca,{ano}_dca_siconfi.json,,,,pipelines/extrator_seguranca.py,revisao_SICONFI_API_auditavel,,2026-05-07,data/public/sorocaba/seguranca/saida/*.csv,"Fonte: DCA anual (nao quadrimestral). Unico extrator da area que usa SICONFI DCA - diferente de saude/educacao que usam PDFs do portal municipal. Sem minimo constitucional; dados anuais comparativos 2020-2025."
Sorocaba,auditoria,2026,public-mock,Dados ficticios locais,,,,"",mock_local,,2026-05-07,2026-05-07,data/public/auditoria/*.json,Mock para desenvolvimento; precisa continuar sinalizado visualmente como ilustrativo.
