data_referencia,municipio,periodo_alvo,orgao,area,tipo_dado,prioridade,status_fonte_original,status_auditavel,url,periodicidade,anos_disponiveis_declarados,granularidade_alvo,formato,metodo_acesso,script_existente,comando_coleta_bruta,camada_destino,publicacao_autorizada,evidencia_local,bloqueio_atual,pedido_lai,agente_responsavel,proximo_passo,observacao
2026-05-29,Paulinia,2020-2026,Prefeitura,dados_abertos,catalogo,alta,lacuna,a_verificar,https://www.paulinia.sp.gov.br/portal/dados-abertos,continua,a_mapear,dataset,html,portal_html,a_criar,inventariar portal de dados abertos,data/manifests,nao,data/manifests/paulinia_seed_sources.csv,Nenhum dataset inventariado ou publicado no projeto.,nao,dados,inventariar_datasets_e_formatos,Fonte oficial inicial; nao publicar sem QA local.
2026-05-29,Paulinia,2020-2026,TCE-SP,receita,receitas,critica,lacuna,a_verificar,https://transparencia.tce.sp.gov.br/municipio/paulinia/2025/receitas,mensal,2020-2026,mensal,html_api,portal_html_api,a_criar,testar API TCE-SP receitas Paulinia,data/manifests,nao,data/manifests/paulinia_seed_sources.csv,API JSON do TCE-SP ainda nao testada no repo.,nao,pipeline,criar_extrator_tce_receitas,Base independente inicial para receitas municipais.
2026-05-29,Paulinia,2020-2026,TCE-SP,despesa,despesas,critica,lacuna,a_verificar,https://transparencia.tce.sp.gov.br/municipio/paulinia/2025/despesas,mensal,2020-2026,mensal,html_api,portal_html_api,a_criar,testar API TCE-SP despesas Paulinia,data/manifests,nao,data/manifests/paulinia_seed_sources.csv,API JSON do TCE-SP ainda nao testada no repo.,nao,pipeline,criar_extrator_tce_despesas,Base independente inicial para despesas municipais e legislativo.
2026-05-29,Paulinia,2020-2026,Camara,despesa,despesas_legislativo,alta,lacuna,a_verificar,https://www.camarapaulinia.sp.gov.br/despesas/,mensal,a_mapear,mensal,html_pdf,portal_html,a_criar,inventariar pagina de despesas da Camara,data/manifests,nao,data/manifests/paulinia_seed_sources.csv,Formato e exportacao ainda nao mapeados.,nao,dados,inventariar_formato_e_periodicidade,Fonte legislativa inicial.
2026-05-29,Paulinia,2020-2026,Camara,transparencia,portal_transparencia,alta,lacuna,a_verificar,https://transparencia-cmpaulinia.smarapd.com.br/#/,continua,a_mapear,dataset,html,portal_html,a_criar,mapear navegacao e exportacao,data/manifests,nao,data/manifests/paulinia_seed_sources.csv,Portal SMARAPD ainda nao mapeado tecnicamente.,nao,dados,mapear_portal_camara_smarapd,Portal citado pela Camara; usar como fonte auxiliar.
2026-05-29,Paulinia,2020-2026,SICONFI,fiscal,rreo_rgf_dca,alta,lacuna,a_verificar,https://apidatalake.tesouro.gov.br/ords/siconfi/,bimestral_anual,2020-2026,bimestral e anual,api,api_publica,a_criar,testar SICONFI IBGE 3536505,data/manifests,nao,data/manifests/paulinia_seed_sources.csv,Extratores existentes de Sorocaba ainda nao parametrizados para Paulinia.,nao,pipeline,parametrizar_siconfi_por_municipio,Fonte federal para anexos fiscais.
2026-05-29,Paulinia,2020-2026,PNCP,compras,contratos_licitacoes_atas,alta,lacuna,a_verificar,https://pncp.gov.br/app/editais,continua,a_mapear,evento/documento,api,api_publica,a_criar,identificar CNPJs e orgaos compradores,data/manifests,nao,data/manifests/paulinia_seed_sources.csv,CNPJs compradores ainda nao mapeados.,nao,pipeline,mapear_cnpjs_pncp,Base nacional para contratacoes publicas.
